[
  {
    "pathPrefix": "/resume/",
    "backend": "https://dy-tsou-resume.pages.dev",
    "stripPrefix": "/resume",
    "ownerRepo": "dytsou/resume",
    "kind": "page",
    "previewUrl": "https://resume.tsou.me"
  },
  {
    "pathPrefix": "/cal/",
    "backend": "https://dy-tsou-cal.pages.dev",
    "stripPrefix": "/cal",
    "ownerRepo": "dytsou/cal",
    "kind": "page",
    "previewUrl": "https://cal.tsou.me"
  },
  {
    "pathPrefix": "/",
    "backend": "https://dy-tsou-me.pages.dev",
    "stripPrefix": "",
    "ownerRepo": "dytsou/site",
    "kind": "site"
  }
]
